{
  "id": "8896d672-b2dd-4ccf-be2d-a51d79bce565",
  "type": "sibling",
  "from": "f6a7b8c9-d0e1-4f2a-3b4c-5d6e7f8a9b03",
  "to": "915b7cde-c6d8-4306-af69-3b1e2185d58f",
  "attributes": {
    "relationship": "brothers",
    "note": "Olwë was the elder brother, Elmo the younger. Both were Teleri princes."
  }
}
