{
  "id": "ade93696-0291-4ca8-9a2c-fe969c6a20a0",
  "type": "sibling",
  "from": "1f2c5d4e-8a71-4e6d-9f3a-2c1b7a540001",
  "to": "915b7cde-c6d8-4306-af69-3b1e2185d58f",
  "attributes": {
    "relationship": "brothers",
    "note": "Elwë (Thingol) was the elder brother, Elmo the younger. Both were Teleri princes."
  }
}
